VA-4152,Stratification Tool for Opioid Risk Mitigation (STORM) predictive model ,VA,VHA: Veterans Health Administration,Health & Medical,,None of the Above,"The STORM model is a predictive model to estimate risk of a suicide or overdose-related health care event or death in the next year.  The model uses patient level predictors extracted from the patient’s medical records (into the VA’s Corporate Data Warehouse), such as diagnoses, prescriptions, and health care utilization, etc.  
This predictive model is used for three purposes. (1) Primary use case is to identify patients at elevated risk of suicide or overdose-related events for referral to an interdisciplinary team for clinical case review.  This team makes treatment recommendations to share with treating providers and documents them in the medical record. The STORM algorithm is used to identify patients to refer to this program at each facility.  Assignment to this case management program has been shown to reduce all-cause mortality in patients estimated at “very high” risk on the STORM predictive model by 22% in the next 4 months. (2) Secondary use case is to help risk stratify patients based on prior health care interactions to support augmentation of risk mitigation interventions and treatments for patients with patterns of care associated with risk of suicide or overdose events. Risk estimates are provided as a sorting/filtering and informational feature on the STORM clinical decision support system.  This decision support system enables population management of patients prescribed opioids or with opioid use disorders, as well as providing curated information to support treatment planning for individual patients. (3) The last use case is to meet the requirements of the Comprehensive Addiction Recovery Act (CARA) mandating that clinicians use VA decision support tools to review patient risks prior to initiating opioid therapy for pain.  Direct synchronized links from the VISTA medical record to the STORM report integrate this decision support summary information into clinician workflows as a support for risk assessment before writing and initial opioid prescription.  Each of these use cases is built into existing clinical workflows completed by overlapping, but different health care providers. For use case 1, designated interdisciplinary risk review teams at each health care system use the risk estimates to determine which patient require risk review.  For use case 2, VA health care providers (e.g., opioid prescribers) and teams (e.g., primary care and general mental health teams) use the risk estimates in combination with decision support recommendations of interventions to consider facilitate and augment risk assessment and treatment planning for their patients on opioid analgesics or being treated for opioid use disorder.  For use case 3, VA medication prescribers or their delegated team members use the categorized risk scores in the context of curated descriptive data from the patient’s medical record to review risk factors and consider risk and benefits of treatment options for pain management before prescribing opioids.  Risk considerations are documented in a clinical note for tracking.   Use of STORM is expected to improve decision-making about opioid prescribing and treatment of patients with opioid use disorders, as well as consistency of use of clinical practice guideline recommended treatment practices for safe management of patients exposed to opioids.  STORM also focuses on ensuring recognition of patient risks and facilitating care coordination across treatment providers for complex patients with multiple interacting disorders. By improving use of risk mitigation practices and treatment interventions, we expect STORM will reduce adverse outcomes for patients exposed to opioids.  Program evaluations support this expectation, finding that implementation of the targeted interdisciplinary review requirements associated with use case 1 significantly reduced all cause mortality in the targeted patient population. 

Links: https://psycnet.apa.org/buy/2017-03732-004
https://www.tandfonline.com/doi/10.1080/08897077.2018.1540376
https://link.springer.com/article/10.1007/s11606-022-07622-1
https://www.ncbi.nlm.nih.gov/pmc/articles/PMC10698768/","The STORM predictive model estimates the risk of having an overdose or suicide-related event in next year for all patients currently receiving a VA opioid analgesic prescription with nightly updates.  For all other active VHA patients, the STORM predictive model estimates the hypothetical risk of having an overdose or suicide-related event in next year, if the patient was prescribed or otherwise had access to low, medium, or high dose opioid analgesics.  These risk estimates are provided to clinicians on a family of dashboards, both as percentage likelihood of an event in the next year, and as a categorical grouping of estimated low, medium, high or very high risk.   Paired with this risk estimate is a summary of all risk factors identified and considered in generating the risk estimate for that patient, and recommendations for risk mitigation and treatment options to consider.  These recommendations are tailored based on patient characteristics identified in the medical record (e.g. Medications for opioid use disorder are recommended for patients seen for an opioid use disorder diagnosis) and patient receipt of these interventions is tracked and displayed on the dashboard.  The STORM dashboards are used by clinicians as an informational tool to summarize and organize medical record information to support risk reviews during treatment planning (e.g. when considering an opioid prescription), for management of patients prescribed opioids or treated for opioid use disorder, and for interdisciplinary case reviews of very high risk patients to ensure safe and effective care coordination and treatment planning across health care providers.",Operation and Maintenance,Both
VA-4156,Vitrea CT Brain Perfusion,VA,VHA: Veterans Health Administration,Health & Medical,,None of the Above,FDA-cleared medical device to assist clinicians and improve healthcare outcomes.,Described in FDA documentation for this device (https://www.accessdata.fda.gov/cdrh_docs/pdf18/K181247.pdf).,Operation and Maintenance,Both
VA-4193,Deep-Learning approaches to develop candidate lists of terms for use in text searches ,VA,VHA: Veterans Health Administration,Health & Medical,,None of the Above,"The intended use is to increase the comprehensiveness of term lists to be used in text-matching approaches to identifying concepts of interest in free-text medical record notes. Text-matching approaches are an efficient method for identifying text of interest in medical notes.  The success of text-matching approaches depends on the quality of term lists used to search for a concept of interest.  While humans can generate word lists for text-matching approaches, the generated word lists are likely to be limited and biased by the vocabulary, language habits, population exposure, and local dialects of the human generating the list.  Deep learning methods can help to augment candidate term lists to help overcome some of these challenges.  Once generated these augmented candidate terms are reviewed by subject matter experts for appropriateness and accuracy of the suggested terms for the concept and use case of interest.  Here we (1) query pre-trained large language models (e.g., ChatGPT or Llama) through a user interface that allows prompting (such as the OpenAI API or CodeLlama) and/or (2) query word and phrase “embedding” models (e.g., Word2Vec and Phrase2Vec) to expand candidate term lists for review by subject matter experts.  Our team has found both approaches effective for expediting the generation of more comprehensive term to concept mappings for use in text-matching algorithms that increase the accuracy of clinical concept extraction.   We expect this use of AI to improve initial brainstorming of terms related to a given concept, resulting in a more sensitive approach to finding information of interest in free-text clinical notes. ","The outputs of this use of AI is a candidate list of terms related to a concept of interest.  This candidate list is combined with suggestions generated by human experts and then these are reviewed by a subject matter expert to generate a final list of terms for use in text-matching algorithms to extract medical record free text mentions of interest. For the pre-trained Large Language model approach, the input is a query prompting for synonyms of terms related to the concept of interest.  The output is the answer provided by the LLM, including the suggested candidate terms and the original terms that were stated in the query.  For the word and phrase embedding models, the input is an initial list of terms that are relevant to the concept of interest and the output are the suggested candidate terms, ranked by their statistical similarity to the original terms, based on the transformation of a clinical corpus into vector space or an “embedding model”.  Regardless of the type of model used, all suggested candidate terms are reviewed by subject matter experts to ensure quality term lists are used in all text searches.",Operation and Maintenance,Neither
VA-4197,Vereos PET/CT,VA,VHA: Veterans Health Administration,Health & Medical,,None of the Above,FDA-cleared medical device to assist clinicians and improve healthcare outcomes.,Described in FDA documentation for this device (https://www.accessdata.fda.gov/cdrh_docs/pdf21/K211764.pdf).,Operation and Maintenance,Both
VA-4234,Recovery Engagement and Coordination for Health – Veterans Enhanced Treatment (REACH VET) 1.0 predictive model,VA,VHA: Veterans Health Administration,Health & Medical,,None of the Above,"The REACH VET 1.0 model is a predictive model using predictors extracted from the patient’s medical records (into the VA’s Corporate Data Warehouse), such as diagnoses, prescriptions, and health care utilization, to estimate statistical risk of a suicide death in the next month.  
This predictive model is used for two purposes. (1) Primary use case is to support identification of patients at elevated statistical risk of suicide in the next month for referral to a clinical case review and outreach program. Staffing guidance to ensure each health care system is staffed to conduct the case review and outreach protocol is established per clinical policy. To date, the population recommended to the clinical case review program has been limited to a number equivalent to 0.1% of the total treated patient population at each facility each month; the number of patients in the program may be modified based on guidance from the Office of Suicide Prevention. The REACH VET 1.0 statistical risk estimates contribute to an algorithm used to identify patients to refer to this program at each facility. (2) Secondary use case is to help risk stratify patients based on prior health care interactions to support augmentation of clinical attention and interventions for patients with patterns of care associated with high suicide risk. This is used, for example, to support clinical review of relevant health care history during triage of Veteran Crisis Line calls and during risk assessment of patients in mental health care.
For use case 1, REACH VET coordinators and REACH VET providers use the list and supporting information to guide execution of the targeted prevention program. For use case 2, Veterans Crisis Line responders and VHA health care providers use the categorized risk scores in the context of curated descriptive data from the patient’s medical record to review risk factors towards optimizing assessment and clinical follow-up.   
The REACH VET 1.0 model is expected to identify a population of patients at elevated risk of suicide and other negative outcomes for review by clinicians; clinicians conduct telephone outreach to identified patients when they deem such outreach appropriate.  This model and targeted prevention in which it is used (i.e. the REACH VET program) is used to augment VHA's extensive clinical suicide prevention program. While VHA conducts universal screening for suicide risk by asking patients structured questions regarding suicidality, this screening process does not identify all patients who go on to die of  suicide. The REACH VET model is intended to identify patients who might be missed in clinical assessment or whose risk may have changed since their last assessment. Here, the REACH VET model identifies patients at statistical risk of suicide, that is they share similarities in their health care data to patients who did die of suicide in the past.  The patients at highest statistical risk are highlighted to mental health providers for additional review. This targeted prevention program has been nationally implemented in VHA health care systems since 2017 and an evaluation of the effects of the REACHVET program was conducted. This evaluation found that REACH VET implementation was associated with greater treatment engagement and new safety plan documentation and fewer mental health admissions, emergency department visits, and suicide attempts. Full findings of this program evaluation are available at:  https://www.ncbi.nlm.nih.gov/pmc/articles/PMC8524305/","The REACH VET predictive model estimates the likelihood of dying of suicide in the next month for each active patient in VHA. This estimate is used as part of an algorithm that considers factors such as the size of the health care system, current patient treatment engagement, and whether the patient has had previous engagement with the REACH VET program to generate a dashboard with patients at high statistical risk of suicide for review by a REACH VET coordinator and identified clinicians at each health care system. The REACH VET dashboard provides information about identified risk factors for the included patients and supports a coordinated case review and, where applicable, clinical outreach process to support identification of care gaps and offer additional services as appropriate.",Operation and Maintenance,Both
VA-4238,Venue; Venue Fit; Venue Go,VA,VHA: Veterans Health Administration,Health & Medical,,None of the Above,FDA-cleared medical device to assist clinicians and improve healthcare outcomes.,Described in FDA documentation for this device (https://www.accessdata.fda.gov/scripts/cdrh/cfdocs/cfPMN/pmn.cfm?ID=K180599).,Operation and Maintenance,Both
VA-4279,Velacur,VA,VHA: Veterans Health Administration,Health & Medical,,None of the Above,FDA-cleared medical device to assist clinicians and improve healthcare outcomes.,Described in FDA documentation for this device (https://www.accessdata.fda.gov/cdrh_docs/pdf22/K223287.pdf).,Operation and Maintenance,Both
VA-4316,2268 Next Generation (2268NextGen),VA,OSVA: Office of the Secretary,Other,This system supports Federal contracting.,Inputting large amounts of data from paper forms into a digital system using AI.,"We receive information via a PDF VA Form. AI builder, a Microsoft product, “reads” the PDF VA Form and the information is transferred to a D-365 CRM database. This transfer of information from the PDF document to the database minimizes the need for human intervention and typographical errors.  ",The AI Builder provides digital data from a PDF Document.,Implementation and Assessment,Neither
VA-4320,Syngo Application Software,VA,VHA: Veterans Health Administration,Health & Medical,,None of the Above,FDA-cleared medical device to assist clinicians and improve healthcare outcomes.,Described in FDA documentation for this device (https://www.accessdata.fda.gov/cdrh_docs/pdf17/K170747.pdf).,Operation and Maintenance,Both
VA-4349,Operationalizing Coronary Artery Calcium Computer Vision Model,VA,VHA: Veterans Health Administration,Health & Medical,,None of the Above,This AI model's purpose is to screen Chest CT scans for coronary artery calcification and notify physicians of patients with increased cardiovascular risk. This will help physicians detect cardiovascular disease earlier and better treat their patients.,The model will output a coronary artery calcium score and also output image masks showing physicians where the model detected coronary artery calcium on the patients chest images.,Acquisition and/or Development,Both
VA-4353,Rapid AI,VA,VHA: Veterans Health Administration,Health & Medical,,None of the Above,FDA-cleared medical device to assist clinicians and improve healthcare outcomes.,Described in FDA documentation for this device (https://www.accessdata.fda.gov/cdrh_docs/pdf23/K233582.pdf).,Operation and Maintenance,Both
VA-4361,"Spine Planning (2.0), Elements Spine Planning, Elements Planning Spine",VA,VHA: Veterans Health Administration,Health & Medical,,None of the Above,FDA-cleared medical device to assist clinicians and improve healthcare outcomes.,Described in FDA documentation for this device (https://www.accessdata.fda.gov/cdrh_docs/pdf22/K223553.pdf).,Operation and Maintenance,Both
VA-4390,VRS Employment Support,VA,VHA: Veterans Health Administration,Education & Workforce,,Improving the quality of written communications using AI tools.,We are using ChatGPT to support veterans in resume development as well as mock interview question if the veteran is interested.,The output is resumes and mock interview questions.,Operation and Maintenance,Neither
VA-4431,Classifying the reportability of and extracting cancer diagnosis information from pathology reports or other clinical documents ,VA,VHA: Veterans Health Administration,Health & Medical,,Searching for information using AI.,"The intended purpose is to highlight and show the extracted information by the system along with the original context for review by the nurse coordinators, within the health informatics tools currently in production, in the National Oncology Program Office. This will decrease the nurse coordinators’ information gathering time and improving their information efficiency. Information may also help identify Veterans with diagnoses of interest for review by the coordinator allowing for additional resources to be activated to support the Veteran if they meet program criteria. 
We do not anticipate this AI to be either safety impacting or rights impacting. The output does not serve as a principal basis for a decision. Coordinators are expected to review the output and corroborate its veracity using source information obtained from the EHR. The system resides completely within approved VA IT boundaries that are fully compliant with FISMA and HIPAA rules with availability and reliability set by OI&T. The information that the algorithm uses for input and its output relates to patient and disease features related to cancer diagnoses and therefore are unlikely to perpetuate inequalities related to protected characteristics. They are unrelated to educational benefits, housing grants, loans, risk assessment for insurance, job training programs, employment services, vocational rehabilitation, or hiring. It does not impact claims and benefits processing.
While the system is envisioned to increase the efficiency of coordinators identifying information elements related the Veteran’s cancer diagnoses, these elements are not envisioned to be related to race, nor creating or promoting disparities. On the contrary, by improving coordinator efficiency, we believe the system will allow more Veterans to be supported; decreasing any existing inequities. It will also allow Coordinators be spend less time gathering information and more time interacting with Veterans, improving their ability to connect with the Veteran, learn about them, and provide Veteran-centric support, including care coordination, tracking, providing access to clinical trials if the Veteran is interested per standard of care policy set by the National Oncology Program Office, or provide other types of support. The system will make it easier for Coordinators to locate information about Veterans related to their diagnoses, however it will not be used for diagnosing disease, recommending treatment plans nor as a tool to monitor a patient’s health. It will not be used for health assessments or interventions, manage or dispense medications, or to automate labs. It will not make any decisions for the provider, but will make it easier for the provider to identify information elements of interest in the course of supporting Veterans. The system will also be entirely redundant, meaning Coordinators will still use information from the EHR to perform their workflows, both to find information about Veterans and to document their interactions. Coordinators will be able to fall back to EHR workflows should the system is unavailable for any reason.  
","Binary label of reportability, i.e. if there is cancer diagnosis in the report. This will be highlighted in the original context and output along with the original context for nurse coordinators to review.  Cancer diagnosis information including histology, site, and subsite. This will be highlighted in the original context and output along with the original context for nurse coordinators to review.",Acquisition and/or Development,Neither
VA-4435,Post discharge 30-day readmission or death prediction model to select patients for expedited postdischarge clinic follow-up.,VA,VHA: Veterans Health Administration,Health & Medical,,None of the Above,"The purpose of this AI is to act as an aid not a replacement for clinical decision-making about whether a patient should have clinical follow-up in the week following discharge (an accelerated timeframe) or follow-up in 2-4 weeks (the regular timeframe). The AI will consider dozens of factors to which a clinician does not have ready access or time to review during a typical discharge process. Patients that are predicted to have an adverse outcome will be recommended a quick follow-up but this will not be mandated, similarly patients not predicted to have an adverse outcome can still be scheduled for quick post discharge follow-up. Predicting which patients will die or be readmitted after discharge is a famously difficult unsolved clinical problem, and this tool will be one more data point for clinicians to aid but not replace clinical judgment during the discharge process.

The AI’s intended benefit is to make our healthcare system more systematic and accurate in identifying high-risk patients at discharge as a primary goal. An aspirational benefit is that this process of more systematic more accurate follow-up for high risk patients will lead to decreased re-admissions and mortality after discharge.",The XG boost system outputs a 0 and 100% probability of readmission or death within 30 days.,Acquisition and/or Development,Both
