VA-4439,Using Artificial Intelligence to Predict Suicide,VA,VHA: Veterans Health Administration,Health & Medical,,Searching for information using AI.,"Prevention of Veteran suicide is VHA’s top clinical priority. We use AI to identify patients with two key risk factors for death by suicide: 1) having access to a gun, and 2) having an active opioid use disorder. This project is funded by and developed with input from the Office of Suicide Prevention.

THREE REASONS KNOWING ABOUT ACCESS TO GUNS IS CRITICAL TO SUICIDE PREVENTION
First, when a person attempts suicide using a gun, the death rate is about 85%. For the most common method of attempting suicide—drug overdose—the death rate is less than 5%. Second, Veterans are more likely to own a gun and know better how to use it than other patients, so Veterans’ death rate when attempting suicide using a gun is even higher. Third, there are things clinicians can do to protect Veterans from their guns while they are suicidal, such as counselling them to give the guns or the ammunition to friends or family until they feel better.  This is always voluntary, but Veterans very often agree to it, because they see and fear the risk. 

WHY KNOWING WHICH PATIENTS HAVE ACTIVE OPIOID USE IS CRITICAL TO SUICIDE PREVENTION
Patients who die by suicide almost always have a prior history of emotional and mental health difficulties. When they die by suicide, it’s usually not due to that history, but rather because some bad life event (such as breaking up with their spouse) happens and then they have an overwhelming impulse to end their lives. 

Opioid use disorder (OUD) contributes to suicide risk in two ways. First, it makes bad life events much more common. It’s hard to keep a job or have good relationships with OUD. Second, OUD also increases impulsivity. That is, among patients who have just lost their jobs, those with OUD are more likely to have the impulse to end their lives. (Among substance use disorders, we focus on OUD because it is very common and there are good treatments available.)


WHY USE AI TO DETERMINE ACCESS TO GUNS?
The need for AI arise from how information is stored in an electronic health record. For historical reasons, when a clinician sees a patient, there are codes they can use to record what diseases (e.g., diabetes) the patient has, but there is no code for having access to a gun. VHA has considered asking all patients during intake for each visit whether they have access to a gun, but this is time consuming and can cause concern among patients about why they’re always being asked about guns. 

AI, specifically natural language processing (NLP) of clinical notes, offers another way to know which patients have guns. We have developed NLP algorithms that are very good at assessing from notes whether a patient owns or has access to a gun. But we use only notes already written by clinicians, any mention of gun access came voluntarily from the patient. However, to find this information, we need a method that can go through notes quickly, and NLP provides that method. 

WHY USE AI TO ASSESS WHETHER PATIENTS HAVE SUBSTANCE USE DISORDERS?
OUD is a disease, and there are disease codes available to record it. However, because there are many different states you can be in with OUD (e.g., actively using vs in rehab vs sober for years), there are over 100 possible ways to code OUD. Most clinical settings (like outpatient clinics and ERs) have short list of commonly used codes for clinicians to pick from, but that may not offer up much specificity. So most clinics will only put on their list a single code, “opioid use, unspecified” and leave off all the more specific codes. Thus, typical coding practice does not differentiate between a patient who is currently using opioids or one who is 10 years sober (and, if you live along time with OUD, it is usually because you spend much of that time sober). That differentiation is important because the increase in impulsivity with OUD is only during active opiate use.

NLP can again be useful, because descriptions of OUD in clinical notes are likely to be much more specific than the codes used","OUR INPUT, OUTPUT, AND INTENDED USER In the “Please add anything else you would like to share” box below we describe in more detail why it is necessary to use AI to find information about gun access or OUD (versus either not having the information or getting that information without using AI). We also describe how we build and test AI models to determine whether a patient has gun access or is actively using opioids. First, however, we think it is important to describe how human clinicians in VHA will use our AI.   The INPUT to our AI models is simply the notes that have already been written on patients. These only contain information volunteered by the patient. The OUTPUT of our models will be simply indicators that a patient **may** have access to a gun or **may** have an active substance use disorder, along with a presentation of the text that leads the AI algorithm to reach its conclusion.   However, the INTENDED USE of the output is that a human mental health clinician be notified about patients at risk, then read the note or notes that led to the determination that the patient was at risk. The clinician may conclude that the AI was incorrect (this occurs about 12-16% of the time with our current models) and drop the issue. Alternatively, the clinician may decide that the patient does have the risk factor and that the risk factor needs to be addressed.   There is no planned interaction between the AI and the patient, nor does the AI make any clinical decisions. Rather, it is a tool to help point clinicians to potentially critical information that they might not otherwise have been aware of.   OUR AI METHOD We begin by creating a list of common terms centered around gun access or OUD. We then pull thousands of pieces of clinical text with these terms in them, and have physicians determine whether the risk factor is present or not. (A term can be present, but the patient can still not have the risk factor in a variety of ways. It could be that “the patient’s brother has a gun” or “the patient has NO gun” or “the patient used to use Fentanyl, but quit”.) The text that has been assessed by physicians is called “labeled data”. We then give our NLP models some of the labeled data, so they can learn what positive and negative examples look like.   For each risk factor, we develop 4 non-neural AI text classification models: random forest, bagging, gradient boosting, and logistic regression with ridge penalization. We also implement two large language models, BioBERT and Bio-ClinicalBERT.   Subsequently, we test each algorithm on other data for which we have (but don’t give the algorithm) the label and ask each algorithm to produce its own labels. We then compare each algorithm’s conclusions to the physicians’ conclusions. That is how we know that our algorithms so far, will be incorrect about 12-16% of the time. Over time, we hope to improve the performance of these algorithms. For example, the large language models are relatively new additions to the AI toolkit and perform better than the non-neural models. We expect further advances over time. However, the current level of accuracy is already higher than many commonly used diagnostic tests, such as mammograms or erythrocyte sedimentation rates.   WHERE DO WE DO THIS WORK? Our team currently uses the Summit Data Platform (SDP) – formerly called the Health Data and Analytics Platform (HDAP) – maintained by the VA Office of Information Technology. This is an Azure Machine Learning environment.",Acquisition and/or Development,Both
VA-4443,RayStation 11B,VA,VHA: Veterans Health Administration,Health & Medical,,None of the Above,FDA-cleared medical device to assist clinicians and improve healthcare outcomes.,Described in FDA documentation for this device (https://www.accessdata.fda.gov/cdrh_docs/pdf22/K220141.pdf).,Operation and Maintenance,Both
VA-4472,Identify access to genetic testing in Veterans with breast cancer. ,VA,VHA: Veterans Health Administration,Health & Medical,,Searching for information using AI.,"Stakeholders in the National Oncology Program that are required to understand quality of standard of care access provided by VA to Veterans with cancer to germline genetic testing. Veterans who have not been provided standard of care access may be provided additional support in the form of care coordination services to ensure they receive standard of care access. 
The AI use case is intended to help the Stakeholders in the National Oncology Program understand quality of standard of care access provided by VA to Veterans with cancer to germline genetic testing.
This will help stakeholders be able to identify which veterans have not been provided with germline genetic testing access more efficiently and at almost real time, thus being able to provide additional support in the form of care coordination services to ensure they receive standard of care access. 
   We do not anticipate this AI to be either safety impacting or rights impacting. The output does not serve as a principal basis for a decision. Coordinators are expected to review the output and corroborate its veracity using source information obtained from the EHR. The system resides completely within approved VA IT boundaries that are fully compliant with FISMA and HIPAA rules with availability and reliability set by OI&T. The information that the algorithm uses for input and its output relates to patient , disease features, and whether genetic testing is offered are related to cancer diagnoses and therefore are unlikely to perpetuate inequalities related to protected characteristics. They are unrelated to educational benefits, housing grants, loans, risk assessment for insurance, job training programs, employment services, vocational rehabilitation, or hiring. It does not impact claims and benefits processing.
While the system is envisioned to increase the efficiency of coordinators identifying information elements related the Veteran’s cancer diagnoses, and whether standard of care access to genetic testing was offered to Veterans, these elements are not envisioned to be related to race, nor creating or promoting disparities. On the contrary, by improving coordinator efficiency and awareness of whether Veterans received the care adherent to VA NOP guidelines, we believe the system will allow more Veterans to be supported in adherence with NOP guidelines; decreasing any existing inequities. It will also allow Coordinators be spend less time gathering information and more time interacting with Veterans, improving their ability to connect with the Veteran, learn about them, and provide Veteran-centric support, including facilitating access to genetic testing per NOP guidelines. The system will make it easier for Coordinators to locate information about Veterans related to their diagnoses, however it will not be used for diagnosing disease, recommending treatment plans nor as a tool to monitor a patient’s health. It will not be used for health assessments or interventions, manage or dispense medications, or to automate labs. It will not make any decisions for the provider but will make it easier for the provider to identify information elements of interest in the course of supporting Veterans. The system will also be entirely redundant, meaning Coordinators will still use information from the EHR to perform their workflows, both to find information about Veterans and to document their interactions. Coordinators will be able to fall back to EHR workflows should the system is unavailable for any reason.  

","Binary output of Yes or no on if the patients have access to germline genetic testing, and the reason of the output. This will be highlighted in the original context and output along with the original context for nurse coordinators to review.",Acquisition and/or Development,Neither
VA-4513,Classify clinical pathway for cancer patients,VA,VHA: Veterans Health Administration,Health & Medical,,Searching for information using AI.,"The VA National Oncology Program has invested in creating clinical pathways that guide providers to provide high quality evidence-based standard of care treatments to Veterans with cancer. However at this time, it is unclear how many or how often providers are ‘on pathway’ or are concordant with this recommendation. Work will focus on leveraging AI to assess degree of adoption of various pathways. For example:  To assess care quality across the VA in regards to genetic testing in Veterans with prostate cancer, and provide the needed information to engage in quality improvement efforts, the VA NOP proposes to develop, evaluate and implement an informatics workflow that is capable of extracting information regarding whether a Veteran with prostate cancer has been offered access to germline and somatic genetic testing. Work will follow the framework NOP developed to assess germline genetic testing in Veterans with breast cancer in response to the Advances in Mammography and Medical Options (MAMMO) for Veterans Act of 2022. Briefly, Veterans receiving care for prostate cancer in VA will be identified using electronic health information in the VA Corporate Data Warehouse, and their latest relevant clinical notes will be retrieved. Data from VistA CPRS prostate cancer pathway templates will provide a gold standard for developing and evaluating the feasibility of using an open-source generative large language model to determine whether a Veteran has been offered genetic testing according to clinical notes. Earlier work has been successful using zero-shot (or few-shot) prompt development. Model fine tuning can be considered should these approaches fail. Upon achieving acceptable accuracy, the model will then be implemented for near real time determination of access to genetic testing at scale, especially in sites where this information is not available. 
This work will allow assessment of quality of care as it relates to adherence to VA endorsed clinical pathways on genetic testing in Veterans with prostate cancer. It will also facilitate efforts for improving care delivered through identification of sites that can be supported through existing efforts such as the National Tele-oncology Office, or cancer care navigation and tracking initiatives.
We do not anticipate this AI to be either safety impacting or rights impacting. The output does not serve as a principal basis for a decision. Stakeholders are expected to review the output at the population level, increasing their awareness of how the system as a whole is attending to Veteran needs per program office policy. Any use of the system to address needs at the site level or Veteran level will involve human review and corroboration of the output veracity using source information obtained from the EHR. The system resides completely within approved VA IT boundaries that are fully compliant with FISMA and HIPAA rules with availability and reliability set by OI&T. The information that the algorithm uses for input and its output relates to documentation of patient, disease, and prior treatment features related to cancer diagnoses and therefore are unlikely to perpetuate inequalities related to protected characteristics. They are unrelated to educational benefits, housing grants, loans, risk assessment for insurance, job training programs, employment services, vocational rehabilitation, or hiring. It does not impact claims and benefits processing.
While the system is envisioned to increase the effectiveness and efficiency of stakeholders identifying information elements related the Veteran’s cancer diagnoses and treatment, these elements are not envisioned to be related to race, nor creating or promoting disparities. On the contrary, by improving identification of off pathway care, we believe the system will offer the opportunity for stakeholders to identify areas where Veterans, or systems in need more support, decreasing any existing inequities. It will not be used for diagnosing disease","Class for clinical pathway, i.e., which clinical pathway the cancer patient is on. This will be highlighted in the original context and output along with the original context for nurse coordinators to review.",Acquisition and/or Development,Neither
VA-4521,Enterprise Command Center - Generative AI ,VA,OIT: Office of Information & Technology,Mission-Enabling (internal agency support),,None of the Above,The benefit of this use case is to provide plain English alert messages to service owners. The current alert language has proven suboptimal and results in a inordinate volume of alerts not being actioned. By feeding alerts into an LLM the message can be reconfigured to be understood by a human who in turn can take appropriate steps to resolve the alert.,Human readable alert messages,Initiated,Neither
VA-4554,Extract patients’ diagnosis information and map the diagnosis to oncotree,VA,VHA: Veterans Health Administration,Health & Medical,,Searching for information using AI.,"Patients’ diagnosis information has only been extracted in the format of ICD0 code, although clinicians are only able to use the diagnosis information that is described according to the oncotree in situations such as clinical trial matching. We aim to use the AI system to identify the diagnosis information according to oncotree. 

This will help highlight the diagnosis information according to oncotree on the clinical documents that the nurse navigators could review more quickly, therefore help the document review more efficiently. 
We do not anticipate this AI to be either safety impacting or rights impacting. The output does not serve as a principal basis for a decision. Coordinators are expected to review the output and corroborate its veracity using source information obtained from the EHR. The system resides completely within approved VA IT boundaries that are fully compliant with FISMA and HIPAA rules with availability and reliability set by OI&T. The information that the algorithm uses for input and its output relates to patient and disease features related to cancer diagnoses and therefore are unlikely to perpetuate inequalities related to protected characteristics. They are unrelated to educational benefits, housing grants, loans, risk assessment for insurance, job training programs, employment services, vocational rehabilitation, or hiring. It does not impact claims and benefits processing.
While the system is envisioned to increase the efficiency of coordinators identifying information elements related the Veteran’s cancer diagnoses, these elements are not envisioned to be related to race, nor creating or promoting disparities. On the contrary, by improving coordinator efficiency, we believe the system will allow more Veterans to be supported; decreasing any existing inequities. It will also allow Coordinators be spend less time gathering information and more time interacting with Veterans, improving their ability to connect with the Veteran, learn about them, and provide Veteran-centric support, including care coordination, tracking, providing access to clinical trials if the Veteran is interested per standard of care policy set by the National Oncology Program Office, or provide other types of support. The system will make it easier for Coordinators to locate information about Veterans related to their diagnoses, however it will not be used for diagnosing disease, recommending treatment plans nor as a tool to monitor a patient’s health. It will not be used for health assessments or interventions, manage or dispense medications, or to automate labs. It will not make any decisions for the provider, but will make it easier for the provider to identify information elements of interest in the course of supporting Veterans. The system will also be entirely redundant, meaning Coordinators will still use information from the EHR to perform their workflows, both to find information about Veterans and to document their interactions. Coordinators will be able to fall back to EHR workflows should the system is unavailable for any reason.  

","Patients’ diagnosis according to oncotree, and this will be highlighted in the original context and output along with the original context for nurse coordinators to review.",Acquisition and/or Development,Neither
VA-4562,Adobe Creative Cloud ,VA,VHA: Veterans Health Administration,Health & Medical,,Creating visually appealing presentations using AI-driven design suggestions.,Develop nursing education presentations ,Used to make animations or to populate AI art.,Operation and Maintenance,Neither
VA-4566,QLAB Advanced Quantification Software,VA,VHA: Veterans Health Administration,Health & Medical,,None of the Above,FDA-cleared medical device to assist clinicians and improve healthcare outcomes.,Described in FDA documentation for this device (https://www.accessdata.fda.gov/cdrh_docs/pdf20/K200974.pdf).,Operation and Maintenance,Both
VA-4595,"Identify cancer patients symptom burden, including symptoms supported by embedded mental health.  ",VA,VHA: Veterans Health Administration,Health & Medical,,Searching for information using AI.,"Mental Health is important for cancer patients and could be barrier for effective and timely cancer care. Approximately one-third of persons with cancer will develop a mood or anxiety disorder. Mental health of Veterans with cancer is a priority for the VA National Oncology Program. We have been tasked to develop and implement a health information technology tool that will facilitate the effectiveness and efficiency of mental health providers embedded in cancer clinics, such as the one embedded in the Oncology clinic in the Durham VA. One of the challenges he faces is to identify patients that are most likely to benefit from the intervention. We aim to use AI to extract patients’ symptom burden information including the symptoms related to mental health needs from clinical notes and surface them for the embedded mental health provider. 
National oncology program embedded mental health specialists and nurse coordinators will review the information, allowing them to efficiently identify Veterans that may benefit from additional support for symptom management or mental health. This could allow embedded mental health specialists to monitor cancer patients among veterans at a higher risk level more closely and provide the most appropriate level of care. It could also potentially help veterans have increased cancer treatment engagement and quality of care, which are essential for cancer patients’ disease prognosis.  
","Information on patient symptom burden including symptoms related to mental health needs of cancer patients, this will be highlighted and output along with the clinical documents that are used to extract the information for the nurse coordinators to review. We do not anticipate this AI to be either safety impacting or rights impacting. The output does not serve as a principal basis for a decision. Coordinators are expected to review the output and corroborate its veracity using source information obtained from the EHR. The system resides completely within approved VA IT boundaries that are fully compliant with FISMA and HIPAA rules with availability and reliability set by OI&T. The information that the algorithm uses for input and its output relates to patient and disease features related to cancer diagnoses as well as descriptions of symptom burden and therefore are unlikely to perpetuate inequalities related to protected characteristics. They are unrelated to educational benefits, housing grants, loans, risk assessment for insurance, job training programs, employment services, vocational rehabilitation, or hiring. It does not impact claims and benefits processing. While the system is envisioned to increase the efficiency of providers identifying information elements related the Veteran’s cancer diagnoses and symptom burden documented in the EHR, these elements are not envisioned to be related to race, nor creating or promoting disparities. On the contrary, by improving efficiency, we believe the system will allow more Veterans to be supported, decreasing any existing inequities. It will also allow providers spend less time gathering information and more time interacting with Veterans, improving their ability to connect with the Veteran, learn about them, and provide Veteran-centric support. The system will make it easier for providers to locate information about Veterans related to their symptom burden, however it will not be used for diagnosing disease, recommending treatment plans nor as a tool to monitor a patient’s health. It will not be used for health assessments or interventions, manage or dispense medications, or to automate labs. It will not make any decisions for the provider but will make it easier for the provider to identify information elements of interest while supporting Veterans. The system will also be entirely redundant, meaning providers will still use information from the EHR to perform their workflows, both to find information about Veterans and to document their interactions. Providers will be able to fall back to EHR workflows should the system is unavailable for any reason.",Acquisition and/or Development,Rights-impacting
VA-4599,Ambulatory heart rhythm monitoring,VA,VHA: Veterans Health Administration,Health & Medical,,Searching for information using AI.,AI is used to analyze 14 days of heart rhythm to narrow down periods of abnormalities and identify such rhythms.,Its a report with various abnormalities identified and listed for the clinician to interpret and make recommendations.,Operation and Maintenance,Both
